<?xml version="1.0" encoding="UTF-8" ?>
<email xmlns:xsi="http://www.w3.org/2001/XMLSchema-instance"
  xsi:schemaLocation="https://docsoc.co.uk/xml/email email.xsd"
  logos="true" agenda="true" social="true" title="Weekly Digest">
  <heading>
    Something
  </heading>
  <text>
    Verbatim text
  </text>

  <heading>Next Jump Christmas Bar Night (manual link &amp; location)</heading>
  <event location="Metric">
    <facebook id="137844650270705" alias="http://docsoc.co.uk/christmas-bar-night" />
    <links>
      <link href="link">Not Facebook</link>
    </links>
  </event>

  <heading>
    Next Jump Christmas Bar Night (automatic)
  </heading>
  <event>
    <facebook id="137844650270705" />
  </event>

  <heading>AlphaGo</heading>
  <event external="true">
    <facebook id="787130688161502" />
    <text>
      I want custom text
    </text>
  </event>

  <text>
    *But this is markdown right*
  </text>

  <hr/>
  <hr/>
  <hr/>

  <sponsor company="bloomberg">
    Sponsor post
  </sponsor>

  <image width="100" src="link to image" alt="alt text" title="title" />

  <sign name="Nik Vangerow"
    role="DoCSoc Secretary"
    facebook="nik.vangerow">
    That's all for now!

    Until next time,
  </sign>
</email>
